{
  "version": "1.1.0",
  "metadata": {
    "architecture": "hailo15l",
    "content_hash": "a6a47be4bdfc6add54fa1347c191dc68c1e08ab6919d32caff72560507ba7fb4",
    "description": "",
    "generation_timestamp": "2025-11-24T12:15:22.990165+00:00"
  },
  "input_video": {
    "resolution": {
      "framerate": 30,
      "height": 1944,
      "width": 2592
    },
    "sensor_id": "SENSOR_0"
  },
  "sensor_calibration_file": "/etc/imaging/cfg/hailo15l/imx675/kit/5mp/profiles/daylight/clip_example_daylight/calib.json",
  "sensor_configuration": {
    "af_i2c_addr": "0x0",
    "af_i2c_bus": -1,
    "drv": "HAILO_IMX675.drv",
    "mode": 0,
    "name": "imx675",
    "pixel_mode": 0,
    "sensor_only": 0
  }
}
