{
  "version": "1.1.0",
  "metadata": {
    "architecture": "hailo15l",
    "content_hash": "c9c42f8c0e2d5cedc844b93f2f91c890b6ae99cc3045c0e848f74b3c1a42d84b",
    "description": "",
    "generation_timestamp": "2026-03-16T10:33:20.658527+00:00"
  },
  "input_video": {
    "resolution": {
      "framerate": 30,
      "height": 1080,
      "width": 1920
    },
    "sensor_id": "SENSOR_0"
  },
  "sensor_calibration_file": "/etc/imaging/cfg/hailo15l/imx662/theia_sl410m/fhd/profiles/HDR/dynamic_privacy_mask_HDR/calib.json",
  "sensor_configuration": {
    "af_i2c_addr": "0x0",
    "af_i2c_bus": -1,
    "drv": "HAILO_IMX662.drv",
    "mode": 1,
    "name": "imx662",
    "pixel_mode": 0,
    "sensor_only": 0
  }
}
