{
  "version": "1.1.0",
  "metadata": {
    "architecture": "hailo15h",
    "content_hash": "3b75018c9ccc07ce1591f1b0202d517dcdb43fe52ef5b5c3520f20bd3377e850",
    "description": "",
    "generation_timestamp": "2025-11-24T12:15:21.231283+00:00"
  },
  "input_video": {
    "resolution": {
      "framerate": 30,
      "height": 2160,
      "width": 3840
    },
    "sensor_id": "SENSOR_0"
  },
  "sensor_calibration_file": "/etc/imaging/cfg/hailo15h/imx678/theia_sl410m/4k/profiles/HDR/ai_example_HDR/calib.json",
  "sensor_configuration": {
    "af_i2c_addr": "0x0",
    "af_i2c_bus": -1,
    "drv": "HAILO_IMX678.drv",
    "mode": 4,
    "name": "imx678",
    "pixel_mode": 0,
    "sensor_only": 0
  }
}
