{
  "version": "1.1.0",
  "metadata": {
    "architecture": "hailo15l",
    "content_hash": "007bb96baeba511e2179ab8558e9669f74e9b89da0650c583115023cdfa22c1a",
    "description": "",
    "generation_timestamp": "2026-03-10T13:53:01.995023+00:00"
  },
  "input_video": {
    "resolution": {
      "framerate": 30,
      "height": 1080,
      "width": 1920
    },
    "sensor_id": "SENSOR_0"
  },
  "sensor_calibration_file": "/etc/imaging/cfg/hailo15l/imx662/theia_sl410m/fhd/profiles/daylight/ai_example_daylight/calib.json",
  "sensor_configuration": {
    "af_i2c_addr": "0x0",
    "af_i2c_bus": -1,
    "drv": "HAILO_IMX662.drv",
    "mode": 0,
    "name": "imx662",
    "pixel_mode": 0,
    "sensor_only": 0
  }
}
