{
  "version": "1.1.0",
  "metadata": {
    "architecture": "hailo15h",
    "content_hash": "0f65d3dda316c750ece9e7208256c356ff4369e38dcb7f83eb3b0e45774a243b",
    "description": "",
    "generation_timestamp": "2026-01-16T01:58:13.413201+00:00"
  },
  "input_video": {
    "resolution": {
      "framerate": 30,
      "height": 1080,
      "width": 1920
    },
    "sensor_id": "SENSOR_0",
    "source_type": "APPSRC"
  },
  "sensor_calibration_file": "/etc/imaging/cfg/hailo15h/imx715/theia_sl410m/4k/profiles/daylight/clip_example_daylight/calib.json",
  "sensor_configuration": {
    "af_i2c_addr": "0x0",
    "af_i2c_bus": -1,
    "drv": "HAILO_IMX715.drv",
    "mode": 0,
    "name": "imx715",
    "pixel_mode": 0,
    "sensor_only": 0
  }
}
