{
  "version": "1.1.0",
  "metadata": {
    "architecture": "hailo15l",
    "content_hash": "34c462c5dd381a8e3da7407181eb9d05ce142b588eac84a170f9f0065783ef65",
    "description": "",
    "generation_timestamp": "2026-02-03T08:55:21.468353+00:00"
  },
  "input_video": {
    "resolution": {
      "framerate": 30,
      "height": 2160,
      "width": 3840
    }
  },
  "sensor_calibration_file": "/etc/imaging/cfg/hailo15l/imx675/theia_sl410m/5mp/profiles/lowlight/frontend_example_jpeg_lowlight/calib.json",
  "sensor_configuration": {
    "af_i2c_addr": "0x0",
    "af_i2c_bus": -1,
    "drv": "HAILO_IMX675.drv",
    "mode": 0,
    "name": "imx675",
    "pixel_mode": 0,
    "sensor_only": 0
  }
}
