{
  "version": "1.1.0",
  "metadata": {
    "architecture": "hailo15l",
    "content_hash": "b9ba703e619010d7c200a3b780fd64fb2b5d4beada3d0bd01fc8fd80c6c60038",
    "description": "",
    "generation_timestamp": "2026-01-18T17:19:58.821974+00:00"
  },
  "input_video": {
    "resolution": {
      "framerate": 30,
      "height": 2160,
      "width": 3840
    },
    "sensor_id": "SENSOR_0"
  },
  "sensor_calibration_file": "/etc/imaging/cfg/hailo15l/imx678/theia_sl410m/4k/profiles/daylight/dynamic_privacy_mask_daylight/calib.json",
  "sensor_configuration": {
    "af_i2c_addr": "0x0",
    "af_i2c_bus": -1,
    "drv": "HAILO_IMX678.drv",
    "mode": 0,
    "name": "imx678",
    "pixel_mode": 0,
    "sensor_only": 0
  }
}
