{
  "version": "1.1.0",
  "metadata": {
    "architecture": "hailo15l",
    "content_hash": "ee8591870b13f921e3f0861c254ec7e3fae6f843a379dfa6857e007a9ac86485",
    "description": "",
    "generation_timestamp": "2025-11-24T12:15:22.930624+00:00"
  },
  "input_video": {
    "resolution": {
      "framerate": 30,
      "height": 1944,
      "width": 2592
    },
    "sensor_id": "SENSOR_0"
  },
  "sensor_calibration_file": "/etc/imaging/cfg/hailo15l/imx675/kit/5mp/profiles/lowlight/webserver_lowlight/calib.json",
  "sensor_configuration": {
    "af_i2c_addr": "0x0",
    "af_i2c_bus": -1,
    "drv": "HAILO_IMX675.drv",
    "mode": 0,
    "name": "imx675",
    "pixel_mode": 0,
    "sensor_only": 0
  }
}
