{
  "version": "1.1.0",
  "metadata": {
    "architecture": "hailo15l",
    "content_hash": "0cd6123aca5960565bce5f5974839b4dbec87d06753729a6ce18051f1c099eb8",
    "description": "",
    "generation_timestamp": "2026-04-15T07:50:16.058831+00:00"
  },
  "input_video": {
    "resolution": {
      "framerate": 30,
      "height": 1944,
      "width": 2592
    },
    "sensor_id": "SENSOR_0"
  },
  "sensor_calibration_file": "/etc/imaging/cfg/hailo15l/imx675/theia_sl410m/5mp/profiles/IR/face_landmarks_IR/calib.json",
  "sensor_configuration": {
    "af_i2c_addr": "0x0",
    "af_i2c_bus": -1,
    "drv": "HAILO_IMX675.drv",
    "mode": 0,
    "name": "imx675",
    "pixel_mode": 0,
    "sensor_only": 0
  }
}
