{
  "version": "1.1.0",
  "metadata": {
    "architecture": "hailo15l",
    "content_hash": "89a5d924918f645fa1faa8a1db3fb00227fb566df336ee7dde44fe64f6e50526",
    "description": "",
    "generation_timestamp": "2026-01-28T17:06:36.364145+00:00"
  },
  "input_video": {
    "resolution": {
      "framerate": 30,
      "height": 1080,
      "width": 1920
    },
    "sensor_id": "SENSOR_0"
  },
  "sensor_calibration_file": "/etc/imaging/cfg/hailo15l/imx307/theia_sl410m/fhd/profiles/daylight/webserver_daylight/calib.json",
  "sensor_configuration": {
    "af_i2c_addr": "0x0",
    "af_i2c_bus": -1,
    "drv": "HAILO_IMX307.drv",
    "mode": 0,
    "name": "imx307",
    "pixel_mode": 0,
    "sensor_only": 0
  }
}
