{
  "version": "1.1.0",
  "metadata": {
    "architecture": "hailo15h",
    "content_hash": "b185702e257346b5e3f7fd1bee89161031565e3ef60e645297c78f36b3c1a9c9",
    "description": "",
    "generation_timestamp": "2025-11-24T12:15:21.677154+00:00"
  },
  "input_video": {
    "resolution": {
      "framerate": 30,
      "height": 2160,
      "width": 3840
    },
    "sensor_id": "SENSOR_0"
  },
  "sensor_calibration_file": "/etc/imaging/cfg/hailo15h/imx678/kit/4k/profiles/HDR/webserver_HDR/calib.json",
  "sensor_configuration": {
    "af_i2c_addr": "0x0",
    "af_i2c_bus": -1,
    "drv": "HAILO_IMX678.drv",
    "mode": 4,
    "name": "imx678",
    "pixel_mode": 0,
    "sensor_only": 0
  }
}
