{
  "version": "1.1.0",
  "metadata": {
    "architecture": "hailo15h",
    "content_hash": "c18e764263752d2b8135e240cef14c944239cf59223b9f735673d2cee1742711",
    "description": "",
    "generation_timestamp": "2026-02-02T12:19:10.693986+00:00"
  },
  "input_video": {
    "resolution": {
      "framerate": 30,
      "height": 1520,
      "width": 2688
    },
    "sensor_id": "SENSOR_0"
  },
  "sensor_calibration_file": "/etc/imaging/cfg/hailo15h/imx664/theia_sl410m/4mp/profiles/daylight/single_stream_daylight/calib.json",
  "sensor_configuration": {
    "af_i2c_addr": "0x0",
    "af_i2c_bus": -1,
    "drv": "HAILO_IMX664.drv",
    "mode": 0,
    "name": "imx664",
    "pixel_mode": 0,
    "sensor_only": 0
  }
}
