{
  "version": "1.1.0",
  "metadata": {
    "architecture": "hailo15l",
    "content_hash": "f9cedcc811bc819d8fd4fd30881dea40ded2a75eafefe9ffea2351db7b5e5e0f",
    "description": "",
    "generation_timestamp": "2025-11-24T12:15:22.952796+00:00"
  },
  "input_video": {
    "resolution": {
      "framerate": 30,
      "height": 1944,
      "width": 2592
    },
    "sensor_id": "SENSOR_0"
  },
  "sensor_calibration_file": "/etc/imaging/cfg/hailo15l/imx675/kit/5mp/profiles/lowlight/single_stream_lowlight_bayer/calib.json",
  "sensor_configuration": {
    "af_i2c_addr": "0x0",
    "af_i2c_bus": -1,
    "drv": "HAILO_IMX675.drv",
    "mode": 0,
    "name": "imx675",
    "pixel_mode": 0,
    "sensor_only": 0
  }
}
