{
  "version": "1.1.0",
  "metadata": {
    "architecture": "hailo15h",
    "content_hash": "6963c2e50e86f3e2c07931374d853f89e55de3e47dd5d4dded8017ae884e7609",
    "description": "",
    "generation_timestamp": "2026-03-08T10:21:47.830547+00:00"
  },
  "input_video": {
    "resolution": {
      "framerate": 30,
      "height": 2160,
      "width": 3840
    },
    "sensor_id": "SENSOR_0"
  },
  "sensor_calibration_file": "/etc/imaging/cfg/hailo15h/imx678/theia_sl410m/4k/profiles/daylight/gst_example_daylight/calib.json",
  "sensor_configuration": {
    "af_i2c_addr": "0x0",
    "af_i2c_bus": -1,
    "drv": "HAILO_IMX678.drv",
    "mode": 0,
    "name": "imx678",
    "pixel_mode": 0,
    "sensor_only": 0
  }
}
