{
  "version": "1.1.0",
  "metadata": {
    "architecture": "hailo15h",
    "content_hash": "60b920b043a82e57b666952949f59b40bce1c77028aab995a23f229e44ffc285",
    "description": "",
    "generation_timestamp": "2025-11-24T12:15:21.326994+00:00"
  },
  "input_video": {
    "resolution": {
      "framerate": 30,
      "height": 2160,
      "width": 3840
    },
    "sensor_id": "SENSOR_0"
  },
  "sensor_calibration_file": "/etc/imaging/cfg/hailo15h/imx678/theia_sl410m/4k/profiles/lowlight/lowlight_bayer_r0225c8/calib.json",
  "sensor_configuration": {
    "af_i2c_addr": "0x0",
    "af_i2c_bus": -1,
    "drv": "HAILO_IMX678.drv",
    "mode": 0,
    "name": "imx678",
    "pixel_mode": 0,
    "sensor_only": 0
  }
}
