{
  "version": "1.1.0",
  "metadata": {
    "architecture": "hailo15h",
    "content_hash": "5d672de68432b9c6edbcf833fb8aa94ecd774c2a334c13761747551be7ee15ac",
    "description": "",
    "generation_timestamp": "2025-11-24T12:15:21.901553+00:00"
  },
  "input_video": {
    "resolution": {
      "framerate": 15,
      "height": 2160,
      "width": 3840
    },
    "sensor_id": "SENSOR_0"
  },
  "sensor_calibration_file": "/etc/imaging/cfg/hailo15h/imx678/kit/4k/profiles/daylight/ai_example_dual_sensor_sensor_0_daylight/calib.json",
  "sensor_configuration": {
    "af_i2c_addr": "0x0",
    "af_i2c_bus": -1,
    "drv": "HAILO_IMX678.drv",
    "mode": 0,
    "name": "imx678",
    "pixel_mode": 0,
    "sensor_only": 0
  }
}
