{
  "version": "1.1.0",
  "metadata": {
    "architecture": "hailo15h",
    "content_hash": "20300d9e9ca65a84f1259fc5493144091cf1fdc97b36eaf6102a78657377acea",
    "description": "",
    "generation_timestamp": "2026-01-18T17:19:55.942599+00:00"
  },
  "input_video": {
    "resolution": {
      "framerate": 30,
      "height": 2160,
      "width": 3840
    },
    "sensor_id": "SENSOR_0"
  },
  "sensor_calibration_file": "/etc/imaging/cfg/hailo15h/imx715/kit/4k/profiles/daylight/dynamic_privacy_mask_daylight/calib.json",
  "sensor_configuration": {
    "af_i2c_addr": "0x0",
    "af_i2c_bus": -1,
    "drv": "HAILO_IMX715.drv",
    "mode": 0,
    "name": "imx715",
    "pixel_mode": 0,
    "sensor_only": 0
  }
}
