{
  "version": "1.1.0",
  "metadata": {
    "architecture": "hailo15h",
    "content_hash": "1a953150981537c045f372055f96243e88f4ddfad7f4567f8671c6df3635d2ed",
    "description": "",
    "generation_timestamp": "2025-11-24T12:15:21.635810+00:00"
  },
  "input_video": {
    "resolution": {
      "framerate": 30,
      "height": 2160,
      "width": 3840
    },
    "sensor_id": "SENSOR_0"
  },
  "sensor_calibration_file": "/etc/imaging/cfg/hailo15h/imx678/theia_sl410m/4k/profiles/daylight/webserver_daylight/calib.json",
  "sensor_configuration": {
    "af_i2c_addr": "0x0",
    "af_i2c_bus": -1,
    "drv": "HAILO_IMX678.drv",
    "mode": 0,
    "name": "imx678",
    "pixel_mode": 0,
    "sensor_only": 0
  }
}
