{
  "version": "1.1.0",
  "metadata": {
    "architecture": "hailo15h",
    "content_hash": "bcf24e3bfd34355ae34aa264f03a225edb281ee18a209053c073844f1864b9ea",
    "description": "",
    "generation_timestamp": "2026-03-08T10:21:49.141429+00:00"
  },
  "input_video": {
    "resolution": {
      "framerate": 30,
      "height": 2160,
      "width": 3840
    },
    "sensor_id": "SENSOR_0"
  },
  "sensor_calibration_file": "/etc/imaging/cfg/hailo15h/imx715/kit/4k/profiles/lowlight/gst_example_lowlight_bayer/calib.json",
  "sensor_configuration": {
    "af_i2c_addr": "0x0",
    "af_i2c_bus": -1,
    "drv": "HAILO_IMX715.drv",
    "mode": 0,
    "name": "imx715",
    "pixel_mode": 0,
    "sensor_only": 0
  }
}
